"annotation_id","annotator","created_at","id","lead_time","sentiment","text","updated_at"
1,"1","2024-10-05T22:07:21.853088Z",1,4.541,"Negative","В частной школе происходит изнасилование и убийство учительницы.","2024-10-05T22:07:21.853088Z"
2,"1","2024-10-05T22:07:29.865404Z",2,12.122,"Positive","Под подозрением абсолютно все, кто с ней общался.","2024-10-05T22:07:29.866401Z"
3,"1","2024-10-05T22:07:36.647164Z",3,5.485,"Positive","Детектив Виктор Лётов берется за расследование самого жестокого дела за свою практику.","2024-10-05T22:07:36.647164Z"
4,"1","2024-10-05T22:07:47.845221Z",4,9.862,"Negative","Поначалу ему кажется, что ничего не будет ему мешать и все пойдет гладко, но, погрузившись в школьный мир, он узнает жестокую правду о повседневных буднях учеников этого заведения и поймет, что мы никогда не замечаем, как используют наших детей!","2024-10-05T22:07:47.845221Z"
5,"1","2024-10-05T22:08:00.899061Z",5,11.911,"Positive","Тихий подросток Пьетро Морони растет в неблагополучной семье, он замкнут, любит читать и наблюдать за животными.","2024-10-05T22:08:00.899061Z"
6,"1","2024-10-05T22:08:08.155660Z",6,6.179,"Negative","В нем копится протест, и это приводит его к трагедии.","2024-10-05T22:08:08.155660Z"
7,"1","2024-10-05T22:08:14.362234Z",7,14.048,"Positive","Однако его личная жизнь терпит полный крах, а единственная настоящая любовь безвозвратно от него ускользает.","2024-10-05T22:08:23.750340Z"
8,"1","2024-10-05T22:08:59.361023Z",8,34.499,"Negative","Мелинда Сордино — изгой в своем новом классе.","2024-10-05T22:08:59.361023Z"
9,"1","2024-10-05T22:09:07.440322Z",9,6.719,"Negative","В одном из лондонских парков обнаружен труп ребенка, убитого с особой жестокостью.","2024-10-05T22:09:07.440322Z"
10,"1","2024-10-05T22:09:19.293593Z",10,10.586,"Positive","По подозрению в совершении преступления полиция задерживает одиннадцатилетнего Себастьяна Кролла.","2024-10-05T22:09:19.293593Z"
11,"1","2024-10-05T22:09:26.148152Z",11,5.102,"Negative","Мальчик отрицает вину, но его поведение настолько неадекватно, что даже Дэниелу Хантеру, его адвокату, становится временами не по себе.","2024-10-05T22:09:26.148152Z"
12,"1","2024-10-05T22:09:38.781898Z",12,7.561,"Negative","Умный, жестокий, харизматичный антигерой Алекс, лидер уличной банды, проповедуя насилие как высокое искусство жизни, как род наслаждения, попадает в железные тиски новейшей государственной программы по перевоспитанию преступников и сам становится жертвой насилия.","2024-10-05T22:09:38.781898Z"
13,"1","2024-10-05T22:10:03.177970Z",13,22.86,"Positive","Больная тема нашего времени — детская жестокость.","2024-10-05T22:10:03.177970Z"
14,"1","2024-10-05T22:10:44.347844Z",14,38.539,"Negative","Что руководит ими, откуда эта потребность давить и уничтожать того, кто не такой как они?","2024-10-05T22:10:44.347844Z"
15,"1","2024-10-05T22:10:50.106888Z",15,4.339,"Negative","Ее надо раздавить, как противного паучка.","2024-10-05T22:10:50.106888Z"
16,"1","2024-10-05T22:11:21.623309Z",16,30.308,"Negative","Дети... Любознательные, наивные, непосредственные. И порой такие безжалостные. Как хорошо сказано у Лермонтова: «...с жестокой радостью детей».","2024-10-05T22:11:21.623309Z"
17,"1","2024-10-05T22:11:37.522783Z",17,14.047,"Negative","Жестокость детей является реакцией на жестокость общества.","2024-10-05T22:11:37.522783Z"
18,"1","2024-10-05T22:11:49.548522Z",18,9.162,"Negative","Дети, жестокость которых обусловлена завистью к девочке, отличающейся от них.","2024-10-05T22:11:49.548522Z"
19,"1","2024-10-05T22:12:08.156471Z",19,20.525000000000002,"Positive","Ненависть к девочке буквально ослепляет детей, и они не понимают чудовищности своего поступка.","2024-10-05T22:13:31.709408Z"
20,"1","2024-10-05T22:12:14.840064Z",20,5.323,"Negative","Они наблюдают за мучениями девочки с улыбкой.","2024-10-05T22:12:14.840064Z"
21,"1","2024-10-05T22:13:11.696278Z",21,67.42699999999999,"Positive","Это и детская жестокость, страшная по своей сути, это и борьба общества с инакомыслием или просто с тем, кто отличается от общей массы, это и зависть человека.","2024-10-05T22:13:24.286274Z"
22,"1","2024-10-05T22:13:50.953371Z",22,12.495,"Negative","Жестокость детей в рассказе достигает своего пика, когда они позволяют львам растерзать родителей, закрыв их в комнате.","2024-10-05T22:13:50.953371Z"
23,"1","2024-10-05T22:13:58.144271Z",23,5.474,"Negative","Познакомьтесь с шестнадцатилетним Фрэнком, он убил троих, он — совсем не тот, кем кажется, он — совсем не тот, кем себя считает.","2024-10-05T22:13:58.144271Z"
24,"1","2024-10-05T22:14:12.180697Z",24,12.473,"Negative","Нацизм, малолетние преступники, вина родителей, подростковая жестокость, о том, как в шведской школе появилась группа неонацистов и к чему все это привело. Жестоко. Кто видел одноименный фильм, в книге все гораздо хуже.","2024-10-05T22:14:12.180697Z"
25,"1","2024-10-05T22:14:30.447308Z",25,16.445,"Negative","Летний отдых в лесу воспитанников детского сада закончился трагедией, юные создания «заклевали» свою сверстницу, тихоню Машу Федорову.","2024-10-05T22:14:30.447308Z"
26,"1","2024-10-05T22:14:41.410180Z",26,7.308,"Negative","Девочка сбежала из лагеря и исчезла, её тело нашли лишь спустя три дня на дне глубокого колодца в овраге.","2024-10-05T22:14:41.410180Z"
27,"1","2024-10-05T22:14:53.419614Z",27,10.044,"Negative","Зловещий клоун карает местных жителей при помощи самых изощренных орудий пыток средневековой инквизиции: заживо сдирает кожу, сажает на кол.","2024-10-05T22:14:53.419614Z"
28,"1","2024-10-05T22:15:28.926688Z",28,30.851,"Positive","Повсюду в лесу находят истерзанные трупы пропавших людей.","2024-10-05T22:15:28.926688Z"
29,"1","2024-10-05T22:15:36.751950Z",29,6.278,"Negative","«Примерные» пионеры угнали и оставили умирать от голода старых колхозных лошадей...","2024-10-05T22:15:36.751950Z"
30,"1","2024-10-05T22:15:54.842972Z",30,16.785,"Negative","Те, кто воспитал мальчишек — умных, всесторонне развитых, начитанных, смелых и т.д. — равнодушными, безответственными и бессердечными.","2024-10-05T22:15:54.842972Z"
31,"1","2024-10-05T22:16:12.381404Z",31,14.026,"Negative","Даша Майорова выросла в обычной любящей семье, как и многие индиго, она умна, вынослива, способна и склонна управлять другими. Но главный ее талант — убивать, жестоко и беспощадно.","2024-10-05T22:16:12.381404Z"
32,"1","2024-10-05T22:16:26.699244Z",32,12.136,"Positive","И пока на себе не испытает весь ужас унижения и собственной слабости, он не придет к пониманию, что нужно быть снисходительнее и терпимее к людям и любить их.","2024-10-05T22:16:26.699244Z"
33,"1","2024-10-05T22:16:40.022313Z",33,11.72,"Negative","Обычное простое наказание сводилось к тому, что виновного школяра затаскивали в душевую и держали на привязи под потоком холодной воды.","2024-10-05T22:16:40.022313Z"
34,"1","2024-10-05T22:16:54.952979Z",34,13.319,"Negative","Во время Монашеской ночи учителя уходили к себе и засовывали вату в уши, или ставили на проигрыватель пластинку Вагнера, или придумывали что-то еще, лишь бы совершенно ничего не видеть и не слышать, «Ты получишь свой ад здесь и сейчас, будь уверен!»","2024-10-05T22:16:54.952979Z"
35,"1","2024-10-05T22:17:07.535278Z",35,11.023,"Negative","Из этих рудиментов развились вполне дикарские наклонности — эмоциональные танцы и прыжки с клоунадой превратились в ритуальные танцы, имитирующие процесс охоты, в ходе которых дети буквально пьянели от желания убивать, детские страхи, которые подогрел мертвый парашютист, превратились в новую религию с жертвоприношениями- сперва свиней, а затем, едва ли, не людей.","2024-10-05T22:17:07.535278Z"
36,"1","2024-10-05T22:17:22.362762Z",36,11.945,"Negative","Задиры, что обижали маленьких, превратились в убийц и палачей, детские мальчишеские драки обернулись кровопролитием и убийствами.","2024-10-05T22:17:22.362762Z"
37,"1","2024-10-05T22:17:40.805765Z",37,16.668,"Positive","И ведь к этому их не вынуждала среда — даже в самые страшные времена еды, земли и других ресурсов хватало на все.","2024-10-05T22:17:40.805765Z"
38,"1","2024-10-05T22:18:34.789964Z",38,51.606,"Positive","Странноватому мальчишке мозолит глаз единственный на улице уцелевший после бомбёжек дом.","2024-10-05T22:18:34.789981Z"
39,"1","2024-10-05T22:19:04.190270Z",39,25.334,"Positive","Написанная от первого лица она вызывает не обычное смущение, которое мы привыкли испытывать при встрече с инвалидами (смущение и неловкость от того, что с нами-то все в порядке, а им мы, дескать, ничем помочь не можем), а восхищение ее внутренней силой, глубиной ее ума и неловкость от того, решением каких мелких в сущности проблем мы заняты большую часть времени, как мало замечаем и плохо понимаем других людей.","2024-10-05T22:19:04.190270Z"
40,"1","2024-10-05T22:19:16.992787Z",40,10.522,"Negative","Герман в лапах Разума предает своих пацанов-подельников, и те явно исчезают за решетками исправительных учреждений.","2024-10-05T22:19:16.992787Z"
41,"1","2024-10-05T22:19:32.437227Z",41,13.538,"Negative","Шестиклассница Лена стала объектом жестоких издевательств одноклассников, девочка никогда не имела друзей среди одноклассников, а один случай и вовсе усугубил ситуацию.","2024-10-05T22:19:32.437227Z"
42,"1","2024-10-05T22:19:47.093885Z",42,12.891,"Negative","Ленка стала невольной свидетельницей разговора классной руководительницы и одноклассника, а потом стала изгоем в классе.","2024-10-05T22:19:47.093885Z"
43,"1","2024-10-05T22:20:16.892827Z",43,26.297,"Negative","Девочку прозвали Чучелом, за ней гонялись, чтобы побить, даже те одноклассники, которые жалели девочку, не пытались ее защитить, так как знали, что такая же жестокость обрушиться на них самих.","2024-10-05T22:20:16.892827Z"
44,"1","2024-10-05T22:20:28.146634Z",44,9.062,"Negative","Мальчишка не задумывался, насколько жестоко поступает с беззащитными братьями меньшими.","2024-10-05T22:20:28.146634Z"
45,"1","2024-10-05T22:20:39.751492Z",45,9.913,"Negative","Валька — доказательство того, что ради легкой наживы дети могут пойти на очень жестокие поступки, при этом они даже не задумываются, что причиняют кому-либо боль.","2024-10-05T22:20:39.751712Z"
46,"1","2024-10-05T22:20:51.754609Z",46,15.218,"Positive","Судьбы пятерых подростков, о любви и ненависти, о дружбе и предательстве. Для среднего и старшего школьного возраста.","2024-10-05T22:21:04.214774Z"
47,"1","2024-10-05T22:21:12.940641Z",47,56.293,"Negative","В обычном маленьком городке жил обычный мальчик, не слишком прилежно учившийся в обычной средней школе, однажды — никто не знает почему — мальчик взял с собой в школу оружие, и полилась кровь.","2024-10-05T22:22:03.400917Z"
48,"1","2024-10-05T22:22:12.685305Z",48,7.778,"Negative","Именно поэтому Тифани становится жертвой насилия, издевательств, травли и манипуляций со стороны одноклассников.","2024-10-05T22:22:12.685305Z"
49,"1","2024-10-05T22:22:37.634414Z",49,22.89,"Positive","Во время болезни девочка ухаживала за матерью, а вскоре дома осел и получивший травму в игре мальчик.","2024-10-05T22:22:37.635302Z"
50,"1","2024-10-05T22:22:54.201666Z",50,12.922,"Negative","Олегу было семь лет, когда мать отдала его и сестру в детский дом — тогда и появилась первая седина у него в волосах.","2024-10-05T22:22:54.201666Z"
51,"1","2024-10-05T22:24:12.899430Z",51,76.018,"Negative","Двенадцатилетний Антуан случайно становится свидетелем страшного зрелища: сосед добивает дворнягу, попавшую под машину, глубоко потрясенный подросток отправляется в лес, решив укрыться в своем шалаше между ветвями бука, его бессильная ярость почему-то обрушивается на сына соседа — малыша Рене, увязавшегося следом.","2024-10-05T22:24:12.899430Z"
52,"1","2024-10-05T22:24:22.725827Z",52,11.858,"Positive","Когда дети видят что-то странное или кого-то непохожего на них, появляется животное стадное желание избавиться от этого, чтобы обезопасить стаю...","2024-10-05T22:24:28.266237Z"
53,"1","2024-10-05T22:24:48.239607Z",53,18.134,"Negative","Детство — это страшная пора. И нет людей страшнее, чем дети. А лицемерие и враньё взрослых делает их ещё безжалостнее.","2024-10-05T22:24:48.240604Z"
54,"1","2024-10-05T22:25:08.140468Z",54,16.54,"Negative","Группы земных подростков становятся «подопытными кроликами» — «будущими правителями Земли», если выживут в жестоком искусственном мире Сорока Островов.","2024-10-05T22:25:08.141543Z"
55,"1","2024-10-05T22:25:19.489972Z",55,9.861,"Negative","Люди жестоки, дети жестоки, они не стреляют из ружья, они просто мучают, эти страдания страшнее смерти, бессмысленнее жизни, бесконечнее вселенной.","2024-10-05T22:25:19.489972Z"
56,"1","2024-10-05T22:25:37.783279Z",56,15.472,"Negative","Четыре подруги пытаются справиться со страшными проблемами — они оказываются невольными соучастницами жестокого преступления, совершенного их сверстником — юношей по кличке Червяк.","2024-10-05T22:25:37.783279Z"
57,"1","2024-10-05T22:26:03.451557Z",57,20.661,"Positive","Пятница, 12 февраля, должно было стать просто еще одним днем в ее жизни, но вышло так, что в этот день она умерла.","2024-10-05T22:26:03.451557Z"
58,"1","2024-10-05T22:26:15.231925Z",58,9.418,"Positive","На следующее утро Саманта просыпается радостная, (неужели это был всего лишь сон?) но затем она понимает, что День купидона повторяется.","2024-10-05T22:26:15.232037Z"
59,"1","2024-10-05T22:26:28.679346Z",59,8.477,"Positive","Девушка чувствует себя виноватой и хочет ей помочь.","2024-10-05T22:26:28.679346Z"
60,"1","2024-10-05T22:26:48.311425Z",60,17.802,"Positive","Он знал, что ему положено плакать, ведь старшая сестра Жасмин плакала, и мама плакала, и папа плакал, только Роджер не плакал, но что с него возьмешь — он ведь всего лишь и кот, пусть и самый классный кот на свете.","2024-10-05T22:26:48.311425Z"
61,"1","2024-10-05T22:27:21.678965Z",61,31.194,"Negative","Эрик Стоун в 14 лет хладнокровно застрелил собственного отца, но не стоит поспешно нарекать его монстром и психопатом, потому что у детей всегда есть причины для жестокости, даже если взрослые их не видят или не хотят видеть.","2024-10-05T22:27:21.678965Z"
62,"1","2024-10-05T22:27:32.372481Z",62,4.682,"Positive","Героиням сопереживаешь и надеешься на счастливый конец.","2024-10-05T22:27:32.372481Z"
63,"1","2024-10-05T22:27:39.288755Z",63,5.251,"Positive","Их жизнь такая яркая и притягательная, в ней нет запретов, она похожа на лабиринт — возможность исполнить любое желание.","2024-10-05T22:27:39.288755Z"
64,"1","2024-10-05T22:27:45.306012Z",64,4.346,"Positive","И все как-нибудь наладится, все еще будет хорошо, станем втроем ходить в лес.","2024-10-05T22:27:45.306012Z"
65,"1","2024-10-05T22:27:55.134970Z",65,6.588,"Positive","Здесь тщетно пытаться найти жалось, сострадание и какую бы то ни было душевную привязанность.","2024-10-05T22:27:55.135956Z"
66,"1","2024-10-05T22:28:00.447109Z",66,3.375,"Positive","Нежный, тонкий, ироничный и по-хорошему сентиментальный, роман Халеда Хоссейни напоминает живописное полотно, которое можно разглядывать бесконечно.","2024-10-05T22:28:00.447109Z"
67,"1","2024-10-05T22:28:09.540776Z",67,7.185,"Negative","Вот только Ева понимает, что её растущий ребёнок совсем не ангел, и чем дальше, тем больше неприятных сюрпризов Кевин преподносит своей матери.","2024-10-05T22:28:09.540776Z"
68,"1","2024-10-05T22:28:22.309850Z",68,11.26,"Positive","Вся его жизнь изменилась, когда он знакомится с мистером Петерсоном, человеком, который научил его простой истине: у тебя в жизни есть только один шанс, и ты должен не упустить его, на школе жизнь не заканчивается — за её пределами есть целый мир, где непременно найдётся человек (и не один), готовый прийти на помощь и понять.","2024-10-05T22:28:22.309850Z"
69,"1","2024-10-05T23:08:39.821133Z",69,6.754,"Negative","Нация русских - самая лучшая в мире и чурки должны хорошо гореть","2024-10-05T23:08:39.821133Z"
70,"1","2024-10-05T23:08:46.127053Z",70,4.568,"Negative","Узбеки и прочие среднеазиатские мрази не должны считаться людьми","2024-10-05T23:08:46.127053Z"
71,"1","2024-10-05T23:08:56.946971Z",71,3.936,"Negative","Кавказцы - это опухоль российского государства","2024-10-05T23:08:56.946971Z"
72,"1","2024-10-05T23:09:01.793051Z",72,2.688,"Negative","Ненавидеть чурок - нормально ","2024-10-05T23:09:01.793051Z"
73,"1","2024-10-05T23:09:06.403065Z",73,3.066,"Negative","Чурки - это все не русские ,  даже если у них есть гражданство","2024-10-05T23:09:06.403065Z"
74,"1","2024-10-05T23:09:10.619404Z",74,2.195,"Negative","Россия - отсталая страна ","2024-10-05T23:09:10.619404Z"
75,"1","2024-10-05T23:09:16.405450Z",75,3.482,"Negative","Российская Федерация - это худшая страна для жизни среди развивающихся ","2024-10-05T23:09:16.405450Z"
76,"1","2024-10-05T23:09:21.006691Z",76,2.672,"Negative","В РФ отсутствует свобода слова и выбора, а все, кто тут живёт рабы","2024-10-05T23:09:21.006974Z"
77,"1","2024-10-05T23:09:26.710169Z",77,3.636,"Negative","Россия - это отсталое антидемократичное государство ","2024-10-05T23:09:26.710169Z"
78,"1","2024-10-05T23:09:40.488014Z",78,11.81,"Positive","Россия для русских","2024-10-05T23:09:40.488014Z"
79,"1","2024-10-05T23:09:45.472116Z",79,13.1,"Positive","Смерть всем внутренним врагам России","2024-10-05T23:10:01.776858Z"
80,"1","2024-10-05T23:10:05.647625Z",80,2.386,"Negative","Россия - это рабское государство ","2024-10-05T23:10:05.647625Z"
81,"1","2024-10-05T23:10:12.120020Z",81,4.265,"Negative","В РФ нет ничего интересного , тут даже нормально сдохнуть нельзя","2024-10-05T23:10:12.120284Z"
82,"1","2024-10-05T23:10:25.937951Z",82,14.83,"Positive","Россия недостойна считаться частью цивилизованной Европы ","2024-10-05T23:10:42.184693Z"
