"annotation_id","annotator","created_at","id","lead_time","sentiment","text","updated_at"340,"1","2024-10-05T23:50:57.621240Z",340,3.316,"Negative","В России всегда найдется что-то неработающее, что ещё и дорого стоит.","2024-10-05T23:50:57.621240Z"
341,"1","2024-10-05T23:51:03.079502Z",341,4.696,"Negative","Русские умеют справляться с кризисом: они просто называют его жизнью.","2024-10-05T23:51:03.079502Z"
342,"1","2024-10-05T23:51:07.000659Z",342,3.392,"Negative","В России есть два правила: первое – все знают как лучше, второе – никто так не делает.","2024-10-05T23:51:07.000659Z"
343,"1","2024-10-05T23:51:10.704498Z",343,3.116,"Negative","Русский человек всегда находит способ усложнить простое дело.","2024-10-05T23:51:10.704498Z"
344,"1","2024-10-05T23:51:15.324566Z",344,3.618,"Negative","В России всегда найдется что-то, что не работает, но в этом нет ничего удивительного.","2024-10-05T23:51:15.324566Z"
345,"1","2024-10-05T23:51:18.962444Z",345,2.602,"Negative","Русский человек не опаздывает, он просто приходит, когда это уже не имеет значения.","2024-10-05T23:51:18.962444Z"
346,"1","2024-10-05T23:51:22.959201Z",346,3.051,"Negative","В России всегда можно найти дорогу, которая ведет в никуда.","2024-10-05T23:51:22.959201Z"
347,"1","2024-10-05T23:51:27.246322Z",347,3.344,"Negative","Русские не ищут смысла в жизни, они просто приспосабливаются к её отсутствию.","2024-10-05T23:51:27.246322Z"
348,"1","2024-10-05T23:51:31.851913Z",348,3.791,"Negative","В России стабильность – это когда ничего не меняется, даже если все говорят об изменениях.","2024-10-05T23:51:31.852430Z"
349,"1","2024-10-05T23:51:40.262517Z",349,7.619,"Positive","Русский человек умеет терпеть всё, кроме спокойной жизни.","2024-10-05T23:51:40.262517Z"
350,"1","2024-10-05T23:51:43.945344Z",350,3.126,"Negative","В России всё возможно, но только если ничего не нужно делать.","2024-10-05T23:51:43.945344Z"
351,"1","2024-10-05T23:51:48.793291Z",351,4.14,"Negative","Русский человек всегда уверен в одном: если проблема не решается, значит, её просто нужно подождать.","2024-10-05T23:51:48.793291Z"
352,"1","2024-10-05T23:51:52.141399Z",352,2.454,"Negative","В России прогресс – это когда становится чуть хуже, но не так быстро.","2024-10-05T23:51:52.141399Z"
353,"1","2024-10-05T23:51:55.691796Z",353,2.507,"Negative","В России можно строить планы на будущее, зная, что они изменятся уже завтра.","2024-10-05T23:51:55.691796Z"
354,"1","2024-10-05T23:51:59.423843Z",354,2.776,"Negative","В России всё всегда идёт по плану, только не по твоему.","2024-10-05T23:51:59.423843Z"
355,"1","2024-10-05T23:52:03.337341Z",355,2.954,"Negative","Русский человек не ищет выхода из ситуации, он ищет, кого в этом обвинить.","2024-10-05T23:52:03.337341Z"
356,"1","2024-10-05T23:52:09.223756Z",356,4.922,"Negative","В России каждое новое обещание властей — это просто старый анекдот на новый лад.","2024-10-05T23:52:09.223756Z"
357,"1","2024-10-05T23:52:16.239811Z",357,6.173,"Positive","У нас в стране всё просто: кто не работает, тот управляет.","2024-10-05T23:52:16.240842Z"
358,"1","2024-10-05T23:52:20.443470Z",358,3.239,"Negative","В России ремонт дорог — это вечная борьба, где дорога всегда проигрывает.","2024-10-05T23:52:20.444564Z"
359,"1","2024-10-05T23:52:25.066551Z",359,3.673,"Negative","Русские никогда не боятся трудностей, они их создают.","2024-10-05T23:52:25.066675Z"
360,"1","2024-10-05T23:52:34.280764Z",360,8.092,"Negative","В России если что-то заработало, значит, это ненадолго.","2024-10-05T23:52:34.280764Z"
361,"1","2024-10-05T23:52:38.136162Z",361,3.052,"Negative","Научный прогресс в России — это когда старые технологии внезапно перестают ломаться.","2024-10-05T23:52:38.136162Z"
362,"1","2024-10-05T23:52:46.746530Z",362,7.75,"Negative","В России всё стабильно плохо, и это вызывает чувство гордости.","2024-10-05T23:52:46.746530Z"
363,"1","2024-10-05T23:52:52.774167Z",363,5.229,"Negative","Русский человек может вынести всё, кроме здравого смысла.","2024-10-05T23:52:52.774167Z"
364,"1","2024-10-05T23:52:57.653507Z",364,4.064,"Negative","В России оптимисты — это те, кто надеется, что не станет ещё хуже.","2024-10-05T23:52:57.653507Z"
365,"1","2024-10-05T23:53:01.954132Z",365,3.394,"Negative","Здесь не любят, когда думаешь сам, ведь за тебя уже всё решили.","2024-10-05T23:53:01.954132Z"
366,"1","2024-10-05T23:53:07.022229Z",366,4.222,"Negative","В России коррупция — это не болезнь, это форма народного искусства.","2024-10-05T23:53:07.022229Z"
367,"1","2024-10-05T23:53:11.101376Z",367,3.42,"Negative","Русский человек верит в лучшее будущее, но живёт так, будто его уже украли.","2024-10-05T23:53:11.102375Z"
368,"1","2024-10-05T23:53:15.746262Z",368,3.665,"Negative","В России демократия — это когда все делают то, что им сказали, и называют это свободой.","2024-10-05T23:53:15.746262Z"
369,"1","2024-10-05T23:53:21.659487Z",369,5.064,"Negative","Русские не жалуются на жизнь, они просто молча терпят и матерятся.","2024-10-05T23:53:21.659487Z"
370,"1","2024-10-05T23:53:28.000205Z",370,5.436,"Negative","В России лучше не спрашивать, что происходит, иначе придётся слушать длинный, бессмысленный ответ.","2024-10-05T23:53:28.000954Z"
371,"1","2024-10-05T23:53:31.382677Z",371,2.449,"Negative","Русский человек не ждёт перемен, он ждёт конца света, чтобы было чему удивляться.","2024-10-05T23:53:31.382677Z"
372,"1","2024-10-05T23:53:35.754478Z",372,3.347,"Negative","В России нет проблем, есть только то, что нельзя называть проблемой.","2024-10-05T23:53:35.754478Z"
373,"1","2024-10-05T23:53:40.188593Z",373,3.577,"Negative","В России честность — это когда ложь звучит чуть правдоподобнее.","2024-10-05T23:53:40.188593Z"
374,"1","2024-10-05T23:53:43.507921Z",374,2.286,"Negative","Русский человек не верит в чудеса, он просто надеется на очередной ""авось"".","2024-10-05T23:53:43.508854Z"
375,"1","2024-10-05T23:53:46.911043Z",375,2.547,"Negative","В России из каждой проблемы можно сделать праздник, лишь бы был повод выпить.","2024-10-05T23:53:46.911043Z"
376,"1","2024-10-05T23:53:55.166672Z",376,7.354,"Negative","В России будущее всегда светлое, потому что его никто не видит.","2024-10-05T23:53:55.166672Z"
377,"1","2024-10-05T23:53:59.370975Z",377,3.284,"Negative","Русские умеют находить выход из любых ситуаций, главное, чтобы кто-то другой виноват был.","2024-10-05T23:53:59.371530Z"
378,"1","2024-10-05T23:54:04.589523Z",378,4.256,"Negative","В России всегда находятся силы на борьбу с врагом, которого нет.","2024-10-05T23:54:04.589523Z"
379,"1","2024-10-05T23:54:08.070370Z",379,2.511,"Negative","Русский человек не просит о помощи, он просто ждёт, когда всё само развалится.","2024-10-05T23:54:08.070370Z"
380,"1","2024-10-05T23:54:11.783693Z",380,2.664,"Negative","В России если что-то и двигается вперёд, то это точно не прогресс.","2024-10-05T23:54:11.783693Z"
381,"1","2024-10-05T23:54:16.058401Z",381,3.249,"Negative","В России каждый знает, как жить правильно, но никто так не живёт.","2024-10-05T23:54:16.058401Z"
382,"1","2024-10-05T23:54:20.055012Z",382,2.963,"Negative","В России проблемы не решаются, они просто становятся частью пейзажа.","2024-10-05T23:54:20.055012Z"
383,"1","2024-10-05T23:54:24.110806Z",383,3.024,"Negative","Русский человек — это тот, кто переживает за будущее, но ничего не делает для настоящего.","2024-10-05T23:54:24.110806Z"
384,"1","2024-10-05T23:54:27.984810Z",384,2.76,"Negative","В России, если кто-то говорит, что всё будет хорошо, он, скорее всего, просто прикрывает свои жопы.","2024-10-05T23:54:27.985305Z"
385,"1","2024-10-05T23:54:32.398183Z",385,3.516,"Negative","Русские могут обойтись без объяснений, потому что все и так всё знают, но боятся это озвучить.","2024-10-05T23:54:32.398183Z"
386,"1","2024-10-05T23:54:36.089975Z",386,2.721,"Negative","В России за правду можно получить по голове, а за ложь — премию.","2024-10-05T23:54:36.089975Z"
387,"1","2024-10-05T23:54:40.324360Z",387,3.236,"Negative","Русский человек находит выход из любой ситуации, но только чтобы свалить всё на кого-то другого.","2024-10-05T23:54:40.324360Z"
388,"1","2024-10-05T23:54:46.951045Z",388,5.741,"Negative","В России порядок — это когда всё разбросано по углам, но не мешает никому.","2024-10-05T23:54:46.951045Z"
389,"1","2024-10-05T23:54:56.866985Z",389,9.298,"Negative","Русские — мастера делать вид, что работают, пока на самом деле занимаются чем угодно, только не работой.","2024-10-05T23:54:56.866985Z"
390,"1","2024-10-05T23:55:08.796364Z",390,10.861,"Negative","В России оптимизм — это не про будущее, а про то, что, возможно, это уже не худший вариант.","2024-10-05T23:55:08.796453Z"
391,"1","2024-10-05T23:55:16.363257Z",391,6.89,"Negative","Русские не умеют говорить «нет», но мастерски умеют делать вид, что это не их проблемы.","2024-10-05T23:55:16.363257Z"
392,"1","2024-10-05T23:55:25.500131Z",392,7.995,"Negative","В России мода на заботу о здоровье выражается в постоянных запойных «разгрузках» после праздников.","2024-10-05T23:55:25.500131Z"
393,"1","2024-10-05T23:55:28.922628Z",393,2.287,"Negative","Русский человек может выпить на брудершафт, но только с теми, кто его не достал.","2024-10-05T23:55:28.922628Z"
394,"1","2024-10-05T23:55:32.627341Z",394,2.749,"Negative","В России, если жизнь подкинула лимоны, значит, кто-то просто решил поиздеваться.","2024-10-05T23:55:32.627857Z"
395,"1","2024-10-05T23:55:36.365018Z",395,2.697,"Negative","Русские не читают инструкции, потому что они уже знают, как всё пойдёт наперекосяк.","2024-10-05T23:55:36.365018Z"
396,"1","2024-10-05T23:55:40.127156Z",396,2.738,"Negative","В России долгожданные перемены — это когда вместо одного дурака приходит другой.","2024-10-05T23:55:40.127156Z"
397,"1","2024-10-05T23:55:43.581789Z",397,2.67,"Negative","Русские делают всё медленно, но уверенно, ведь никуда не спешат — у них есть время.","2024-10-05T23:55:43.581789Z"
398,"1","2024-10-05T23:55:47.128703Z",398,2.496,"Negative","В России даже собаки выглядят так, будто готовы завести вас на первую же «прогулку».","2024-10-05T23:55:47.128703Z"
399,"1","2024-10-05T23:55:50.942968Z",399,2.886,"Negative","Русский человек не плачет над пролитым молоком — он с удовольствием выпьет оставшуюся часть.","2024-10-05T23:55:50.942968Z"
400,"1","2024-10-05T23:55:54.874973Z",400,2.824,"Negative","В России даже обманчивое счастье — это больше, чем просто фальшивка.","2024-10-05T23:55:54.874973Z"
401,"1","2024-10-05T23:55:58.914837Z",401,2.999,"Negative","Русские не умеют выбирать, они просто останавливаются на первом попавшемся.","2024-10-05T23:55:58.915533Z"
402,"1","2024-10-05T23:56:04.398018Z",402,4.58,"Negative","В России каждый сам себе художник, но картина всегда одна — жизнь в говне.","2024-10-05T23:56:04.398018Z"
403,"1","2024-10-05T23:56:08.672133Z",403,3.507,"Negative","Русский человек предпочитает действовать в ситуации «пока всё горит», потому что так веселее.","2024-10-05T23:56:08.672133Z"
404,"1","2024-10-05T23:56:12.708264Z",404,3.372,"Negative","В России главное — не то, что вы делаете, а то, как это выглядит со стороны.","2024-10-05T23:56:12.708264Z"
405,"1","2024-10-05T23:56:16.814395Z",405,3.156,"Negative","Русские работают за идею, но обычно забывают, где оставили свою идею.","2024-10-05T23:56:16.814395Z"
406,"1","2024-10-05T23:56:20.225159Z",406,2.74,"Negative","В России мир поделён на тех, кто думает, и тех, кто живёт, и вторых всегда больше.","2024-10-05T23:56:20.225159Z"
407,"1","2024-10-05T23:56:23.571368Z",407,2.428,"Negative","Русский человек знает, что говорит с теми, кто не может его понять, но всё равно продолжает.","2024-10-05T23:56:23.571368Z"
408,"1","2024-10-05T23:56:27.556666Z",408,2.937,"Negative","В России «разобраться» — это значит сделать всё ещё хуже, но с улыбкой на лице.","2024-10-05T23:56:27.556666Z"
409,"1","2024-10-05T23:56:31.692511Z",409,3.05,"Negative","Русские не хотят чего-то большого, они просто довольствуются тем, что хотя бы что-то есть.","2024-10-05T23:56:31.693517Z"
410,"1","2024-10-05T23:56:38.918062Z",410,6.154,"Negative","В России всегда можно найти способ что-то испортить, даже если это что-то — выходные.","2024-10-05T23:56:38.918062Z"
411,"1","2024-10-05T23:56:43.842589Z",411,3.782,"Negative","Русский человек уверен, что жизнь — это не игра, а сплошное шоу с дурацким сценарием.","2024-10-05T23:56:43.842727Z"
412,"1","2024-10-05T23:56:47.460928Z",412,2.548,"Negative","В России даже солнце светит по расписанию, но никто не знает, когда это расписание будет выполнено.","2024-10-05T23:56:47.461106Z"
413,"1","2024-10-05T23:56:52.370308Z",413,3.902,"Negative","Русские умеют делать даже мелкие радости в жизни настоящими проблемами.","2024-10-05T23:56:52.370308Z"
414,"1","2024-10-05T23:56:57.129177Z",414,3.807,"Negative","В России даже собака знает, что есть хозяин, а есть тот, кто всегда уходит в ""долгую прогулку"".","2024-10-05T23:56:57.129177Z"
415,"1","2024-10-05T23:57:01.881116Z",415,3.923,"Positive","Русские живут по принципу: если не знаешь, что делать, просто подожди, пока всё само решится.","2024-10-05T23:57:01.881160Z"
416,"1","2024-10-05T23:57:05.658918Z",416,2.881,"Negative","В России праздник — это когда есть повод выпить, а не когда есть что отпраздновать.","2024-10-05T23:57:05.658918Z"
417,"1","2024-10-05T23:57:08.807990Z",417,2.79,"Negative","Русский человек знает, что в каждом анекдоте есть доля правды, но предпочитает не замечать её.","2024-10-05T23:57:08.807990Z"
418,"1","2024-10-05T23:57:12.475031Z",418,3.091,"Negative","В России даже отчаяние уходит в отпуск — слишком много работы, чтобы им заниматься.","2024-10-05T23:57:12.476057Z"
419,"1","2024-10-05T23:57:15.647885Z",419,2.476,"Negative","Русские всегда находят способ отдохнуть, даже если это значит просто не работать.","2024-10-05T23:57:15.647885Z"
420,"1","2024-10-05T23:57:19.307628Z",420,2.97,"Negative","В России будни — это когда ты встал, пошёл на работу и снова лег спать.","2024-10-05T23:57:19.307628Z"
421,"1","2024-10-05T23:57:24.648470Z",421,4.979,"Negative","Русский человек может сказать «да», но в душе всегда готов к «нет».","2024-10-05T23:57:24.648470Z"
422,"1","2024-10-05T23:57:27.893588Z",422,2.602,"Negative","В России даже вечный двигатель уже давно сломался от постоянной рутинной работы.","2024-10-05T23:57:27.893588Z"
423,"1","2024-10-05T23:57:31.748427Z",423,2.729,"Negative","Русские знают, что делать в критической ситуации: обвинить в этом соседей и уехать на дачу.","2024-10-05T23:57:31.748427Z"
424,"1","2024-10-05T23:57:36.857634Z",424,3.971,"Negative","В России даже курица может быть начальником, если ей повезёт с яйцом.","2024-10-05T23:57:36.858672Z"
425,"1","2024-10-05T23:57:40.665818Z",425,2.793,"Negative","Русский человек понимает, что жизнь — это не бег, а затыкание дыр в системе.","2024-10-05T23:57:40.665818Z"
426,"1","2024-10-05T23:57:44.780253Z",426,2.912,"Negative","В России даже коммунальные проблемы решаются на уровне творчества: можно написать о них песню.","2024-10-05T23:57:44.780253Z"
427,"1","2024-10-05T23:57:48.767971Z",427,3.293,"Negative","Русские могут не слушать, но при этом давать советы лучше всех.","2024-10-05T23:57:48.767971Z"
428,"1","2024-10-05T23:57:52.420832Z",428,2.846,"Negative","В России лучший способ потратить время — это начать что-то делать и бросить на полдороги.","2024-10-05T23:57:52.420832Z"
429,"1","2024-10-05T23:57:56.226657Z",429,2.999,"Negative","Русский человек знает, что нельзя верить своим ушам, когда речь идёт о новых идеях.","2024-10-05T23:57:56.226657Z"
430,"1","2024-10-05T23:58:01.288666Z",430,4.365,"Negative","В России закон о честности — это не про правила, а про отсутствие правил.","2024-10-05T23:58:01.288666Z"
431,"1","2024-10-05T23:58:10.219457Z",431,7.991,"Negative","Русские не спешат, потому что знают: всё, что можно сделать сегодня, можно сделать и завтра, с теми же результатами.","2024-10-05T23:58:10.219457Z"
432,"1","2024-10-05T23:58:15.777752Z",432,4.385,"Negative","В России даже бесполезные вещи могут стать источником гордости, если ими правильно похвастаться.","2024-10-05T23:58:15.778452Z"
433,"1","2024-10-05T23:58:19.226702Z",433,2.628,"Negative","Русский человек всегда готов к неожиданностям, потому что всё самое плохое уже случилось.","2024-10-05T23:58:19.226702Z"
434,"1","2024-10-05T23:58:25.585153Z",434,5.307,"Negative","В России есть одна неизменная истина: всё, что дорого, всегда ломается в самый неподходящий момент.","2024-10-05T23:58:25.585153Z"
435,"1","2024-10-05T23:58:29.004347Z",435,2.754,"Negative","Русские не боятся перемен, они просто предпочитают их не замечать.","2024-10-05T23:58:29.004347Z"
436,"1","2024-10-05T23:58:33.824855Z",436,3.644,"Negative","В России даже ужасные новости воспринимаются как повод для анекдота.","2024-10-05T23:58:33.825293Z"
437,"1","2024-10-05T23:58:38.784719Z",437,4.151,"Negative","Русский человек знает, что здоровье — это не цель, а просто нечто, что можно потерять.","2024-10-05T23:58:38.784719Z"
438,"1","2024-10-05T23:58:43.351763Z",438,3.751,"Negative","В России даже самые нелепые идеи становятся трендами, если за ними кто-то хорошо понаблюдает.","2024-10-05T23:58:43.351763Z"
439,"1","2024-10-05T23:59:40.150479Z",439,4.544,"Negative","Русские любят обсуждать прошлое, чтобы не вспоминать о будущем.","2024-10-05T23:59:40.150479Z"
440,"1","2024-10-05T23:59:45.718022Z",440,5.007,"Negative","В России счастье — это когда все живы, а проблемы не слишком назойливые.","2024-10-05T23:59:45.718979Z"
441,"1","2024-10-05T23:59:49.964348Z",441,3.421,"Negative","Русский человек умеет извлекать выгоду даже из самых плохих ситуаций, просто не всегда осознаёт это.","2024-10-05T23:59:49.965341Z"
442,"1","2024-10-06T00:00:04.003311Z",442,13.074,"Positive","В России даже простые вопросы могут стать философскими, если задать их в нужный момент.","2024-10-06T00:00:04.003311Z"
443,"1","2024-10-06T00:00:09.782468Z",443,4.793,"Negative","Русские живут по принципу: если не можешь изменить ситуацию, просто посмейся над ней.","2024-10-06T00:00:09.782468Z"
444,"1","2024-10-06T00:00:17.770272Z",444,6.975,"Positive","В России даже солнце иногда прячется за тучами, когда его все ждут с нетерпением.","2024-10-06T00:00:17.770272Z"
445,"1","2024-10-06T00:00:25.637270Z",445,6.917,"Positive","Русский человек никогда не опаздывает — он просто выбирает оптимальное время для входа в комнату.","2024-10-06T00:00:25.637270Z"
446,"1","2024-10-06T00:00:33.734676Z",446,7.189,"Negative","В России даже коммунальные службы могут отдохнуть, если это не в их планах.","2024-10-06T00:00:33.734676Z"
447,"1","2024-10-06T00:00:43.132845Z",447,8.808,"Negative","Русские умеют собираться на отдых, но, как правило, остаются дома — там тоже весело.","2024-10-06T00:00:43.132845Z"
448,"1","2024-10-06T00:00:52.710013Z",448,8.633,"Negative","В России даже серые будни могут стать яркими, если добавить немного алкоголя.","2024-10-06T00:00:52.710013Z"
