"annotation_id","annotator","created_at","id","lead_time","sentiment","text","updated_at"244,"1","2024-10-05T23:34:37.002749Z",244,3.39,"Negative","В этой стране люди боятся друг друга, потому что доносительство стало новой нормой, как в худшие времена репрессий.","2024-10-05T23:34:37.003465Z"
245,"1","2024-10-05T23:34:41.093885Z",245,3.037,"Negative","Россия — это страна, где любое желание выйти за рамки установленного жёстко подавляется на всех уровнях.","2024-10-05T23:34:41.094915Z"
246,"1","2024-10-05T23:34:45.048570Z",246,3.039,"Negative","В России простые граждане каждый день сталкиваются с хамством и равнодушием чиновников, для которых люди — это лишь статистика.","2024-10-05T23:34:45.048570Z"
247,"1","2024-10-05T23:38:29.475902Z",247,223.452,"Negative","Россия — это место, где семьи распадаются из-за бедности, потому что государство не поддерживает тех, кто пытается жить честно.","2024-10-05T23:38:29.475902Z"
248,"1","2024-10-05T23:38:31.853989Z",248,1.533,"Negative","В этой стране каждый день превращается в борьбу за выживание, когда власть отбирает у людей последнее.","2024-10-05T23:38:31.853989Z"
249,"1","2024-10-05T23:38:34.857262Z",249,2.047,"Negative","Россия — это страна, где вместо развития инфраструктуры деньги тратятся на военные парады и памятники прошлому.","2024-10-05T23:38:34.857262Z"
250,"1","2024-10-05T23:38:38.036645Z",250,2.386,"Negative","В России нет пространства для критического мышления, ведь любое несогласие карается как измена родине.","2024-10-05T23:38:38.036645Z"
251,"1","2024-10-05T23:38:41.292951Z",251,2.39,"Negative","Россия — это место, где все реформы остаются только на бумаге, не принося реальных изменений в жизнь народа.","2024-10-05T23:38:41.292951Z"
252,"1","2024-10-05T23:38:45.914239Z",252,3.73,"Negative","В этой стране каждый талантливый человек рано или поздно задаёт себе вопрос: уехать или потеряться в системе навсегда?","2024-10-05T23:38:45.914239Z"
253,"1","2024-10-05T23:43:19.323304Z",253,272.604,"Negative","Россия — это страна, где страх стал основой государственной идеологии, и никто не осмеливается его разрушить.","2024-10-05T23:43:19.323304Z"
254,"1","2024-10-05T23:43:23.511656Z",254,3.192,"Negative","В России даже здравоохранение стало платным, несмотря на все заявления о его бесплатности и доступности для всех.","2024-10-05T23:43:23.512767Z"
255,"1","2024-10-05T23:43:26.210274Z",255,1.753,"Negative","Россия — это место, где власть готова подавить любой намёк на независимость или автономию, чтобы удержать контроль.","2024-10-05T23:43:26.210274Z"
256,"1","2024-10-05T23:44:00.041021Z",256,4.629,"Negative","В этой стране люди перестали мечтать, потому что каждую мечту рано или поздно разрушает реальность.","2024-10-05T23:44:00.041021Z"
257,"1","2024-10-05T23:44:02.618178Z",257,1.786,"Negative","Россия — это страна, где литература умирает, поглощённая потоком поверхностной пропаганды и развлечений.","2024-10-05T23:44:02.618178Z"
258,"1","2024-10-05T23:44:05.508568Z",258,2.023,"Negative","В России единственное, что по-настоящему развивается, — это система подавления и контроля, а не наука и культура.","2024-10-05T23:44:05.508568Z"
259,"1","2024-10-05T23:44:08.476191Z",259,2.092,"Negative","Россия — это место, где патриотизм насаждается силой, превращая любовь к стране в обязанность, а не в искреннее чувство.","2024-10-05T23:44:08.476191Z"
260,"1","2024-10-05T23:44:10.898448Z",260,1.709,"Negative","В этой стране культура глушится громкими парадами и ложными лозунгами, в то время как реальные проблемы игнорируются.","2024-10-05T23:44:10.898448Z"
261,"1","2024-10-05T23:44:16.482560Z",261,4.734,"Negative","Россия — это страна, где человек никогда не чувствует себя свободным, потому что на каждом шагу его ограничивают невидимые цепи власти.","2024-10-05T23:44:16.482685Z"
262,"1","2024-10-05T23:44:21.442085Z",262,4.252,"Negative","Россия — это страна, где власть боится людей с идеями, потому что идеи могут разрушить устоявшуюся систему страха и подавления.","2024-10-05T23:44:21.442085Z"
263,"1","2024-10-05T23:44:24.693390Z",263,2.428,"Negative","В России каждый, кто пытается изменить что-то к лучшему, сталкивается с непреодолимой бюрократической стеной.","2024-10-05T23:44:24.693867Z"
264,"1","2024-10-05T23:44:28.500669Z",264,2.943,"Negative","Россия — это место, где чиновники могут позволить себе всё, что угодно, зная, что им никогда не придётся отвечать за свои действия.","2024-10-05T23:44:28.500669Z"
265,"1","2024-10-05T23:44:32.382519Z",265,3.04,"Negative","В этой стране критика власти воспринимается как преступление, даже если она обоснована и справедлива.","2024-10-05T23:44:32.382519Z"
266,"1","2024-10-05T23:44:35.757334Z",266,2.508,"Negative","Россия — это страна, где журналистика больше не существует как независимая профессия, превратившись в орудие пропаганды.","2024-10-05T23:44:35.757334Z"
267,"1","2024-10-05T23:44:39.005715Z",267,2.355,"Negative","В России культура потребления давно превзошла культуру созидания, и люди больше не верят в важность творчества.","2024-10-05T23:44:39.006787Z"
268,"1","2024-10-05T23:44:42.098345Z",268,2.228,"Negative","Россия — это место, где каждый, кто пытается отстаивать свои права, оказывается предателем в глазах государства.","2024-10-05T23:44:42.098345Z"
269,"1","2024-10-05T23:44:45.034252Z",269,2.087,"Negative","В этой стране справедливость — это пустое слово, потому что закон всегда работает в интересах сильных, а не слабых.","2024-10-05T23:44:45.034252Z"
270,"1","2024-10-05T23:44:47.764543Z",270,1.98,"Negative","Россия — это страна, где богатые живут по своим правилам, а бедные вынуждены играть по чужим, не имея права выбора.","2024-10-05T23:44:47.764543Z"
271,"1","2024-10-05T23:44:51.420370Z",271,2.737,"Negative","В России люди больше не чувствуют гордости за свою страну, потому что национальная идея свелась к угнетению и запретам.","2024-10-05T23:44:51.420370Z"
272,"1","2024-10-05T23:44:54.360509Z",272,2.178,"Negative","Россия — это место, где молодёжь утрачивает веру в перемены, потому что государственная машина подавляет любые попытки к развитию.","2024-10-05T23:44:54.361465Z"
273,"1","2024-10-05T23:44:57.745710Z",273,2.498,"Negative","В этой стране люди привыкли жить с ощущением безнадежности, потому что каждый день приносит лишь новые ограничения.","2024-10-05T23:44:57.745886Z"
274,"1","2024-10-05T23:45:02.125018Z",274,3.416,"Negative","Россия — это страна, где социальная поддержка существует только на словах, и каждый вынужден сам справляться с проблемами.","2024-10-05T23:45:02.125018Z"
275,"1","2024-10-05T23:45:05.333217Z",275,2.378,"Negative","В России людям приходится смиряться с несправедливостью, потому что бороться за свои права просто опасно.","2024-10-05T23:45:05.333217Z"
276,"1","2024-10-05T23:45:08.585503Z",276,2.094,"Negative","Россия — это место, где искусство и культура гибнут под давлением цензуры и государственной пропаганды.","2024-10-05T23:45:08.585503Z"
277,"1","2024-10-05T23:45:11.659141Z",277,2.222,"Negative","В этой стране даже литература превращается в средство контроля, подстраиваясь под государственные интересы.","2024-10-05T23:45:11.659141Z"
278,"1","2024-10-05T23:45:14.785570Z",278,2.081,"Negative","Россия — это страна, где малейшее проявление независимости воспринимается как угроза, которую нужно уничтожить.","2024-10-05T23:45:14.785570Z"
279,"1","2024-10-05T23:45:18.362950Z",279,2.703,"Negative","В России права женщин остаются в тени, несмотря на все разговоры о равенстве и свободе.","2024-10-05T23:45:18.363901Z"
280,"1","2024-10-05T23:45:22.153715Z",280,2.919,"Negative","Россия — это место, где коррупция настолько глубоко укоренилась в обществе, что люди уже воспринимают её как норму.","2024-10-05T23:45:22.153715Z"
281,"1","2024-10-05T23:45:42.120971Z",281,19.064,"Negative","В этой стране будущего не существует, потому что оно постоянно отодвигается на второй план ради сохранения власти.","2024-10-05T23:45:42.120971Z"
282,"1","2024-10-05T23:45:45.672208Z",282,2.668,"Negative","Россия — это страна, где каждое новое поколение теряет веру в возможность изменений, потому что система всегда остаётся прежней.","2024-10-05T23:45:45.672604Z"
283,"1","2024-10-05T23:45:49.347756Z",283,2.793,"Negative","В России умирают амбиции, потому что любые попытки подняться выше встречают сопротивление и зависть.","2024-10-05T23:45:49.347756Z"
284,"1","2024-10-05T23:45:52.164569Z",284,1.991,"Negative","Россия — это место, где люди живут в страхе, потому что государство научилось управлять через подавление эмоций и свобод.","2024-10-05T23:45:52.164569Z"
285,"1","2024-10-05T23:45:55.205330Z",285,2.217,"Negative","В этой стране слово ""инновации"" звучит как насмешка, потому что все деньги уходят не на развитие, а на укрепление контроля.","2024-10-05T23:45:55.206359Z"
286,"1","2024-10-05T23:45:59.568419Z",286,3.454,"Negative","Россия — это страна, где вместо поддержки предпринимательства правительство предпочитает создавать всё новые и новые барьеры.","2024-10-05T23:45:59.568506Z"
287,"1","2024-10-05T23:46:02.458248Z",287,2.153,"Negative","В России идея патриотизма извратилась, став всего лишь инструментом для оправдания репрессий и закрытия ртов недовольным.","2024-10-05T23:46:02.458248Z"
288,"1","2024-10-05T23:46:05.515450Z",288,2.197,"Negative","Россия — это место, где законы пишутся не для людей, а против них, чтобы ещё сильнее ограничить их свободу.","2024-10-05T23:46:05.516447Z"
289,"1","2024-10-05T23:46:08.365847Z",289,2.11,"Negative","В этой стране здравый смысл давно уступил место лояльности власти, и никто больше не задумывается о настоящем благе для народа.","2024-10-05T23:46:08.365847Z"
290,"1","2024-10-05T23:46:11.861134Z",290,2.84,"Negative","Россия — это страна, где у власти сидят люди, не понимающие нужд и чаяний обычных граждан, потому что они живут в своём собственном мире.","2024-10-05T23:46:11.861134Z"
291,"1","2024-10-05T23:46:15.334747Z",291,2.436,"Negative","В России даже время как будто остановилось, потому что здесь никто не думает о будущем — все поглощены выживанием в настоящем.","2024-10-05T23:46:15.334747Z"
292,"1","2024-10-05T23:46:19.155555Z",292,2.964,"Negative","Русские славятся своим умением находить выход из трудных ситуаций. Но еще лучше они умеют находить туда вход.","2024-10-05T23:46:19.155555Z"
293,"1","2024-10-05T23:46:26.065378Z",293,6.03,"Positive","Русский человек читает инструкцию только тогда, когда точно понял, что поломал.","2024-10-05T23:46:26.065378Z"
294,"1","2024-10-05T23:46:33.013203Z",294,5.997,"Negative","Никогда не воюйте с русскими. На каждую вашу военную хитрость они ответят непредсказуемой глупостью.","2024-10-05T23:46:33.013203Z"
295,"1","2024-10-05T23:46:39.192811Z",295,5.223,"Negative","Японец лечится за три года до появления болезни, а русский — за три дня до смерти.","2024-10-05T23:46:39.192811Z"
296,"1","2024-10-05T23:46:48.485656Z",296,8.473,"Negative","Умом Россию не понять. Наливай!","2024-10-05T23:46:48.486711Z"
297,"1","2024-10-05T23:46:53.553905Z",297,4.185,"Negative","Какой русский не мечтает в понедельник утром о вечере пятницы…","2024-10-05T23:46:53.553905Z"
298,"1","2024-10-05T23:46:57.815522Z",298,3.743,"Negative","Велика Россия, а ступить некуда.","2024-10-05T23:46:57.815522Z"
299,"1","2024-10-05T23:47:04.464774Z",299,5.869,"Positive","Только наш человек знает два языка: русский и … русский разговорный.","2024-10-05T23:47:04.464774Z"
300,"1","2024-10-05T23:47:10.783186Z",300,5.446,"Negative","Россией управлять несложно, но совершенно бесполезно.","2024-10-05T23:47:10.783186Z"
301,"1","2024-10-05T23:47:15.231106Z",301,3.668,"Negative","В политической экономии есть два метода: европейский — отложить и русский — одолжить","2024-10-05T23:47:15.231106Z"
302,"1","2024-10-05T23:47:18.736240Z",302,2.875,"Negative","На голодный желудок русский человек ничего делать и думать не хочет, а на сытый — не может.","2024-10-05T23:47:18.736399Z"
303,"1","2024-10-05T23:47:22.015062Z",303,2.281,"Negative","Нет такой чистой и светлой мысли, которую бы русский человек не смог бы выразить в грязной матерной форме.","2024-10-05T23:47:22.015974Z"
304,"1","2024-10-05T23:47:25.673366Z",304,2.671,"Negative","Лень простого русского человека — это не грех, а совершенно необходимое средство нейтрализации кипучей активности руководящих им дураков.","2024-10-05T23:47:25.673366Z"
305,"1","2024-10-05T23:47:29.175112Z",305,2.481,"Negative","Для русских туристов в иностранных отелях всё что не прибито к полу — сувенир.","2024-10-05T23:47:29.175112Z"
306,"1","2024-10-05T23:47:34.952400Z",306,4.915,"Negative","Что русскому хорошо, то России — смерть.","2024-10-05T23:47:34.952400Z"
307,"1","2024-10-05T23:47:46.919868Z",307,11.354,"Negative","Только русская женщина, остановив на скаку коня, продолжает считать себя хрупкой и нежной феей.","2024-10-05T23:47:46.919868Z"
308,"1","2024-10-05T23:47:50.074985Z",308,2.554,"Negative","Россия — страна талантов. Талантов масса, работать некому.","2024-10-05T23:47:50.074985Z"
309,"1","2024-10-05T23:47:52.906630Z",309,2.131,"Negative","Наша страна богатая, но временно бедная.","2024-10-05T23:47:52.906630Z"
310,"1","2024-10-05T23:47:56.637251Z",310,2.831,"Negative","Два состояния чистоты в России: 1) вся грязь замёрзла; 2) вся грязь подсохла.","2024-10-05T23:47:56.637251Z"
311,"1","2024-10-05T23:47:59.790000Z",311,2.273,"Negative","Российская мечта — выйти на пенсию, а потом еще долго-долго работать.","2024-10-05T23:47:59.790000Z"
312,"1","2024-10-05T23:48:02.928727Z",312,2.223,"Negative","Русские пьют двумя способами. До тех пор, пока не кончатся деньги или до состояния полной невменяемости. Впрочем, создается впечатление, что деньги у них никогда не кончаются.","2024-10-05T23:48:02.928727Z"
313,"1","2024-10-05T23:48:06.104535Z",313,2.282,"Negative","В России нет дорог - только направления.","2024-10-05T23:48:06.104535Z"
314,"1","2024-10-05T23:48:09.310804Z",314,2.245,"Negative","Если русский человек решил ничего не делать, то его не остановить.","2024-10-05T23:48:09.311802Z"
315,"1","2024-10-05T23:48:13.547715Z",315,3.342,"Negative","Все национальности в мире — ИМЕНА СУЩЕСТВИТЕЛЬНЫЕ, и только мы, РУССКИЕ — прилагательное.","2024-10-05T23:48:13.547715Z"
316,"1","2024-10-05T23:48:18.487366Z",316,4.063,"Negative","И только русский может по пьяни три часа убеждать иностранца в том, что мы русские - идиоты, и дать ему в морду, когда тот согласится!!","2024-10-05T23:48:18.487366Z"
317,"1","2024-10-05T23:48:34.998855Z",317,5.005,"Negative","Старая русская примета: разбитая бутылка водки - к несчастью.","2024-10-05T23:48:34.998855Z"
318,"1","2024-10-05T23:48:39.899924Z",318,4.116,"Negative","В России все автомобили, по сути, внедорожники.","2024-10-05T23:48:39.899924Z"
319,"1","2024-10-05T23:48:45.409907Z",319,4.438,"Negative","Русский человек всегда думает — что делать, и очень редко — чего делать не следует.","2024-10-05T23:48:45.409907Z"
320,"1","2024-10-05T23:48:50.492675Z",320,4.127,"Negative","Когда едешь по российским дорогам, главное - держаться подальше от других дураков.","2024-10-05T23:48:50.493689Z"
321,"1","2024-10-05T23:48:54.356817Z",321,2.993,"Negative","В России две проблемы: дураки и дороги, причем первые всегда ремонтируют вторые","2024-10-05T23:48:54.356817Z"
322,"1","2024-10-05T23:48:58.186181Z",322,3.202,"Negative","Умирать-то на войне русские хорошо научились. Вот только жить хорошо никак не научатся.","2024-10-05T23:48:58.186181Z"
323,"1","2024-10-05T23:49:01.501952Z",323,2.386,"Negative","Русский человек прекрасно знает, что его всегда обманывали, и искренне верит, что в следующий раз его не проведут. ","2024-10-05T23:49:01.501993Z"
324,"1","2024-10-05T23:49:10.612370Z",324,8.008,"Positive","В России всегда есть выбор: либо стоять в очереди, либо ждать в очереди.","2024-10-05T23:49:10.612370Z"
325,"1","2024-10-05T23:49:18.620563Z",325,6.868,"Positive","Русский человек знает, что обещанного три года ждут, но всё равно надеется на завтра.","2024-10-05T23:49:18.620563Z"
326,"1","2024-10-05T23:49:27.400683Z",326,8.04,"Negative","В России все умеют строить планы, которые никогда не сбываются.","2024-10-05T23:49:27.400683Z"
327,"1","2024-10-05T23:49:33.534338Z",327,5.535,"Positive","Русские всегда готовы к неожиданностям, ведь в России это называется будни.","2024-10-05T23:49:33.534338Z"
328,"1","2024-10-05T23:49:44.413912Z",328,9.914,"Positive","В России если за что-то взялись, то бросать это будут долго и с энтузиазмом.","2024-10-05T23:49:44.413912Z"
329,"1","2024-10-05T23:49:51.771565Z",329,6.442,"Negative","Русский человек не ищет легких путей, ведь зачем, если есть окольные.","2024-10-05T23:49:51.772434Z"
330,"1","2024-10-05T23:50:00.465923Z",330,7.723,"Negative","Россия – страна, где терпение – не добродетель, а необходимость.","2024-10-05T23:50:00.465923Z"
331,"1","2024-10-05T23:50:06.412928Z",331,5.035,"Negative","В России всегда есть работа, только она никому не нужна.","2024-10-05T23:50:06.413685Z"
332,"1","2024-10-05T23:50:14.161564Z",332,6.82,"Positive","Русский человек всегда надеется на лучшее, но готовится к худшему.","2024-10-05T23:50:14.161564Z"
333,"1","2024-10-05T23:50:19.887492Z",333,4.889,"Negative","В России всегда найдется что-то важное, что можно не сделать.","2024-10-05T23:50:19.888433Z"
334,"1","2024-10-05T23:50:27.935641Z",334,7.279,"Negative","В России умеют ждать. Например, автобусы и перемену к лучшему.","2024-10-05T23:50:27.935641Z"
335,"1","2024-10-05T23:50:32.585417Z",335,3.756,"Negative","В России всё стабильно: обещания никогда не выполняются вовремя.","2024-10-05T23:50:32.585417Z"
336,"1","2024-10-05T23:50:38.031635Z",336,4.498,"Negative","В России только две гарантии в жизни – налоги и очереди.","2024-10-05T23:50:38.031635Z"
337,"1","2024-10-05T23:50:42.276871Z",337,3.111,"Negative","Русский человек никогда не теряет надежды, но регулярно теряет ключи.","2024-10-05T23:50:42.276871Z"
338,"1","2024-10-05T23:50:46.694003Z",338,3.475,"Negative","В России всегда можно быть уверенным в одном: всё поменяется, чтобы остаться как есть.","2024-10-05T23:50:46.694003Z"
339,"1","2024-10-05T23:50:53.343799Z",339,5.872,"Positive","Русские не делают ошибок, они создают новые традиции.","2024-10-05T23:50:53.343799Z"
